{
  "schemaVersion": 1,
  "id": "classic.buttons.conformance",
  "profileId": "m3-classic.compose-material3-1.4.0",
  "componentModelId": "classic.buttons",
  "status": "incomplete",
  "generatedBy": "tools/generate_material_conformance_report.py",
  "gates": [
    {
      "id": "reference-model",
      "checkerPath": "tools/check_material_reference_model.py",
      "status": "pass",
      "errorCount": 0,
      "errors": []
    },
    {
      "id": "structural-conformance",
      "checkerPath": "tools/check_material_structural_conformance.py",
      "status": "pass",
      "errorCount": 0,
      "errors": []
    },
    {
      "id": "renderer-conformance",
      "checkerPath": "tools/check_material_renderer_conformance.py",
      "status": "pass",
      "errorCount": 0,
      "errors": []
    },
    {
      "id": "visual-contract",
      "checkerPath": "tools/check_material_visual_contract.py",
      "status": "pass",
      "errorCount": 0,
      "errors": []
    }
  ],
  "summary": {
    "componentCount": 32,
    "modeledCount": 5,
    "fullyConformantCount": 0,
    "incompleteCount": 5,
    "notModeledCount": 27,
    "failedCount": 0,
    "headlinePassCounts": {
      "structure": 1,
      "tokens": 5,
      "states": 5,
      "rendering": 0
    }
  },
  "components": [
    {
      "componentId": "button.text",
      "name": "Text Button",
      "family": "Buttons",
      "modelStatus": "modeled",
      "profileId": "m3-classic.compose-material3-1.4.0",
      "componentModelId": "classic.buttons",
      "headline": {
        "structure": "not-evaluated",
        "tokens": "pass",
        "states": "pass",
        "rendering": "pending-runtime"
      },
      "dimensions": {
        "structure": {
          "status": "not-evaluated",
          "reason": "no-evidence-suite",
          "sourceIds": [],
          "caseCount": 0,
          "assertionCount": 0,
          "stateCount": 0,
          "themeCount": 0,
          "targetCount": 0,
          "passedTargetCount": 0
        },
        "tokens": {
          "status": "pass",
          "reason": "verified-static",
          "sourceIds": [
            "classic.buttons.text.renderer"
          ],
          "caseCount": 10,
          "assertionCount": 70,
          "stateCount": 5,
          "themeCount": 2,
          "targetCount": 0,
          "passedTargetCount": 0
        },
        "states": {
          "status": "pass",
          "reason": "verified-static",
          "sourceIds": [
            "classic.buttons.text.renderer"
          ],
          "caseCount": 10,
          "assertionCount": 30,
          "stateCount": 5,
          "themeCount": 2,
          "targetCount": 0,
          "passedTargetCount": 0
        },
        "semanticRendering": {
          "status": "pass",
          "reason": "verified-static",
          "sourceIds": [
            "classic.buttons.text.renderer"
          ],
          "caseCount": 10,
          "assertionCount": 100,
          "stateCount": 5,
          "themeCount": 2,
          "targetCount": 0,
          "passedTargetCount": 0
        },
        "visualRendering": {
          "status": "pending-runtime",
          "reason": "awaiting-reviewed-reference",
          "sourceIds": [
            "classic.buttons.visual"
          ],
          "caseCount": 10,
          "assertionCount": 0,
          "stateCount": 5,
          "themeCount": 2,
          "targetCount": 4,
          "passedTargetCount": 0
        }
      },
      "overallStatus": "incomplete"
    },
    {
      "componentId": "button.filled",
      "name": "Filled Button",
      "family": "Buttons",
      "modelStatus": "modeled",
      "profileId": "m3-classic.compose-material3-1.4.0",
      "componentModelId": "classic.buttons",
      "headline": {
        "structure": "pass",
        "tokens": "pass",
        "states": "pass",
        "rendering": "pending-runtime"
      },
      "dimensions": {
        "structure": {
          "status": "pass",
          "reason": "verified-static",
          "sourceIds": [
            "classic.buttons.filled.structure"
          ],
          "caseCount": 10,
          "assertionCount": 90,
          "stateCount": 5,
          "themeCount": 2,
          "targetCount": 0,
          "passedTargetCount": 0
        },
        "tokens": {
          "status": "pass",
          "reason": "verified-static",
          "sourceIds": [
            "classic.buttons.filled.renderer"
          ],
          "caseCount": 10,
          "assertionCount": 70,
          "stateCount": 5,
          "themeCount": 2,
          "targetCount": 0,
          "passedTargetCount": 0
        },
        "states": {
          "status": "pass",
          "reason": "verified-static",
          "sourceIds": [
            "classic.buttons.filled.renderer"
          ],
          "caseCount": 10,
          "assertionCount": 30,
          "stateCount": 5,
          "themeCount": 2,
          "targetCount": 0,
          "passedTargetCount": 0
        },
        "semanticRendering": {
          "status": "pass",
          "reason": "verified-static",
          "sourceIds": [
            "classic.buttons.filled.renderer"
          ],
          "caseCount": 10,
          "assertionCount": 100,
          "stateCount": 5,
          "themeCount": 2,
          "targetCount": 0,
          "passedTargetCount": 0
        },
        "visualRendering": {
          "status": "pending-runtime",
          "reason": "awaiting-reviewed-reference",
          "sourceIds": [
            "classic.buttons.visual"
          ],
          "caseCount": 10,
          "assertionCount": 0,
          "stateCount": 5,
          "themeCount": 2,
          "targetCount": 4,
          "passedTargetCount": 0
        }
      },
      "overallStatus": "incomplete"
    },
    {
      "componentId": "button.filled-tonal",
      "name": "Filled Tonal Button",
      "family": "Buttons",
      "modelStatus": "modeled",
      "profileId": "m3-classic.compose-material3-1.4.0",
      "componentModelId": "classic.buttons",
      "headline": {
        "structure": "not-evaluated",
        "tokens": "pass",
        "states": "pass",
        "rendering": "pending-runtime"
      },
      "dimensions": {
        "structure": {
          "status": "not-evaluated",
          "reason": "no-evidence-suite",
          "sourceIds": [],
          "caseCount": 0,
          "assertionCount": 0,
          "stateCount": 0,
          "themeCount": 0,
          "targetCount": 0,
          "passedTargetCount": 0
        },
        "tokens": {
          "status": "pass",
          "reason": "verified-static",
          "sourceIds": [
            "classic.buttons.filled-tonal.renderer"
          ],
          "caseCount": 10,
          "assertionCount": 70,
          "stateCount": 5,
          "themeCount": 2,
          "targetCount": 0,
          "passedTargetCount": 0
        },
        "states": {
          "status": "pass",
          "reason": "verified-static",
          "sourceIds": [
            "classic.buttons.filled-tonal.renderer"
          ],
          "caseCount": 10,
          "assertionCount": 30,
          "stateCount": 5,
          "themeCount": 2,
          "targetCount": 0,
          "passedTargetCount": 0
        },
        "semanticRendering": {
          "status": "pass",
          "reason": "verified-static",
          "sourceIds": [
            "classic.buttons.filled-tonal.renderer"
          ],
          "caseCount": 10,
          "assertionCount": 100,
          "stateCount": 5,
          "themeCount": 2,
          "targetCount": 0,
          "passedTargetCount": 0
        },
        "visualRendering": {
          "status": "pending-runtime",
          "reason": "awaiting-reviewed-reference",
          "sourceIds": [
            "classic.buttons.visual"
          ],
          "caseCount": 10,
          "assertionCount": 0,
          "stateCount": 5,
          "themeCount": 2,
          "targetCount": 4,
          "passedTargetCount": 0
        }
      },
      "overallStatus": "incomplete"
    },
    {
      "componentId": "button.outlined",
      "name": "Outlined Button",
      "family": "Buttons",
      "modelStatus": "modeled",
      "profileId": "m3-classic.compose-material3-1.4.0",
      "componentModelId": "classic.buttons",
      "headline": {
        "structure": "not-evaluated",
        "tokens": "pass",
        "states": "pass",
        "rendering": "pending-runtime"
      },
      "dimensions": {
        "structure": {
          "status": "not-evaluated",
          "reason": "no-evidence-suite",
          "sourceIds": [],
          "caseCount": 0,
          "assertionCount": 0,
          "stateCount": 0,
          "themeCount": 0,
          "targetCount": 0,
          "passedTargetCount": 0
        },
        "tokens": {
          "status": "pass",
          "reason": "verified-static",
          "sourceIds": [
            "classic.buttons.outlined.renderer"
          ],
          "caseCount": 10,
          "assertionCount": 100,
          "stateCount": 5,
          "themeCount": 2,
          "targetCount": 0,
          "passedTargetCount": 0
        },
        "states": {
          "status": "pass",
          "reason": "verified-static",
          "sourceIds": [
            "classic.buttons.outlined.renderer"
          ],
          "caseCount": 10,
          "assertionCount": 30,
          "stateCount": 5,
          "themeCount": 2,
          "targetCount": 0,
          "passedTargetCount": 0
        },
        "semanticRendering": {
          "status": "pass",
          "reason": "verified-static",
          "sourceIds": [
            "classic.buttons.outlined.renderer"
          ],
          "caseCount": 10,
          "assertionCount": 130,
          "stateCount": 5,
          "themeCount": 2,
          "targetCount": 0,
          "passedTargetCount": 0
        },
        "visualRendering": {
          "status": "pending-runtime",
          "reason": "awaiting-reviewed-reference",